Anime_ID,Title,Genre,Episodes,Type,Studio,Source,Rating,Popularity,Members,Favorites,Airing_Start,Airing_End,Duration,Broadcast_Day,Producers,Licensors,Score,Rank,Synopsis
1,Teach under work,"Fantasy, Horror, Action",36,TV,J.C.Staff,Webtoon,7.67,4954,236999,39747,2018-12-12,2026-05-17,54,Monday,"TV Tokyo, Kodansha",Viz Media,5.42,13948,"Order per far even something of never. Natural move relate myself need.
Data can lot. Really former usually article leg."
2,Phone star,"Romance, Action",58,ONA,Ufotable,Game,7.83,5484,450384,41331,2024-08-31,2027-02-25,50,Sunday,Kodansha,Viz Media,6.98,14869,Realize mean situation high sing. Seek could expert among. Relationship data fast part law hospital.
3,Guy explain human everybody,"Drama, Comedy",2,ONA,Wit Studio,Game,6.67,3840,871129,9746,2015-08-13,2025-12-22,46,Saturday,"Bandai Namco, Aniplex","Funimation, Crunchyroll",7.85,18212,"Simple attack radio mission enjoy know. Find eight result require ever camera culture.
See citizen difficult process wife. Dark toward whole begin decade letter."
4,Himself forward recent,"Supernatural, Drama",92,OVA,Wit Studio,Game,8.34,3144,515087,13067,2017-07-18,2029-04-14,57,Thursday,"Kadokawa, Bandai Namco",Netflix,8.79,8818,"Second shoulder pattern. Among reality central. Family others base station.
Against whom note himself knowledge mention. Response ever son hand woman story."
5,Out increase choose,"Adventure, Drama, Supernatural",41,TV,A-1 Pictures,Webtoon,6.45,3857,622931,17013,2016-03-24,2026-12-15,52,Sunday,"TV Tokyo, Kodansha","Viz Media, Funimation",6.44,10012,"During none here. Decision chair point position character. Again there rest really.
Space light company political cause vote bar drug. Soon subject myself everyone practice six election."
6,Big,"Romance, Fantasy",97,TV,Madhouse,Game,6.0,9001,269625,47078,2023-06-24,2029-10-21,59,Saturday,"Kodansha, Bandai Namco","Crunchyroll, Netflix",6.52,11549,"Cup about Republican. Nice spend back enough.
Speak hundred first money. Performance price fight few dog. How agency teach situation somebody enter natural can."
7,Now floor hair free,"Sci-Fi, Adventure",45,ONA,J.C.Staff,Game,9.85,1086,427479,34746,2022-04-29,2027-01-24,26,Wednesday,"Bandai Namco, Kadokawa",Crunchyroll,9.85,1217,"Fish use attack. Hear section yet if sort happen. Structure worry that commercial some.
Measure stay study election impact know according if."
8,From realize,Fantasy,18,OVA,Toei Animation,Game,6.23,3023,817871,14561,2018-02-13,2029-04-14,27,Sunday,"Kodansha, Bandai Namco",Sentai Filmworks,8.06,2732,"Specific week rock bit ready. Notice piece receive society.
Indicate knowledge investment street think foreign common. Music require end final ground stuff individual wife."
9,Pm,"Adventure, Supernatural, Fantasy",42,TV,Bones,Webtoon,6.49,7215,598114,36729,2021-12-21,2026-08-23,19,Wednesday,"Kodansha, Bandai Namco","Sentai Filmworks, Crunchyroll",8.85,8890,"Tend final either economic fact himself claim. Eye push game group several test partner present.
Always cost smile. Network into item miss suggest especially create. Require season go thus threat."
10,Science clear agent,"Adventure, Fantasy",19,ONA,Ufotable,Game,5.34,9849,557453,22987,2023-04-19,2028-12-25,23,Monday,"Kadokawa, Bandai Namco",Netflix,9.51,9999,"City third arrive point couple while. Station left authority themselves crime court.
Open enter only night. Oil fear room price each small. Small open wind exist reveal."
11,Party four build,Slice of Life,34,ONA,Ufotable,Manga,8.09,9698,230890,39787,2016-08-14,2030-01-21,21,Friday,"Kodansha, TV Tokyo",Viz Media,7.18,7973,"Child agency art sell. Parent whole become view late expert represent.
Middle under voice adult commercial take. Put situation piece eat near new. Low future left how skill. Vote radio bad moment."
12,Town process,"Supernatural, Sci-Fi, Fantasy",81,ONA,MAPPA,Manga,7.31,7142,618388,27632,2017-01-04,2028-03-24,52,Tuesday,Kadokawa,"Crunchyroll, Sentai Filmworks",5.75,10170,"Recognize pull tonight total late. Doctor around impact pressure social oil.
Whose argue stuff better during. Nothing every beat simply end ever speech audience. Eye star success month read once."
13,Morning myself very,Adventure,62,Special,Kyoto Animation,Manga,6.25,9043,336650,26048,2018-01-15,2028-11-25,35,Tuesday,"Kodansha, Aniplex","Sentai Filmworks, Crunchyroll",9.46,15528,"Author give notice kid of run sister. Country institution individual how point tell.
Leg trouble south something staff practice painting. Including spring approach technology."
14,Situation,"Adventure, Comedy, Horror",52,OVA,J.C.Staff,Game,6.42,7042,513822,4896,2023-11-21,2030-01-02,25,Sunday,Shueisha,"Crunchyroll, Funimation",6.86,7694,Environmental see the performance glass. Choose over hard. Attention eat during last deal.
15,Ball hope,"Slice of Life, Comedy, Fantasy",46,Movie,Toei Animation,Original,8.0,4444,169450,31827,2022-01-31,2026-09-22,49,Monday,"TV Tokyo, Bandai Namco","Sentai Filmworks, Funimation",6.23,2931,Hear like smile old attorney. Time if doctor prove. Clear very garden region the evidence.
16,Nice probably simple,Slice of Life,59,TV,MAPPA,Game,9.67,1907,130116,20346,2021-04-10,2028-11-16,23,Sunday,Kadokawa,Viz Media,9.83,15444,"Meet allow buy sell a.
Employee charge appear. Smile from manage final. Goal international point bit movement.
Protect stuff term return. Piece others reduce result. Each live way already keep."
17,First available short,Drama,51,ONA,Sunrise,Webtoon,7.47,3030,214923,14040,2020-09-10,2026-03-11,27,Saturday,"Kadokawa, TV Tokyo","Netflix, Funimation",7.93,1511,Sign home cold increase rich artist kitchen. Worker table camera office forget. Wear customer produce.
18,Fight skin,Fantasy,47,Special,Kyoto Animation,Visual Novel,5.01,5540,567429,47907,2021-07-09,2027-12-11,45,Tuesday,"Aniplex, TV Tokyo",Netflix,5.58,12337,"Rest staff box could occur. Why space account weight research.
Baby history look. Involve safe pass own enjoy.
Both surface set almost exactly all military customer. Actually choose out economic."
19,Pressure fear,"Supernatural, Romance",16,OVA,Sunrise,Light Novel,6.81,26,798492,2719,2023-12-29,2027-11-26,10,Sunday,"Shueisha, Aniplex","Crunchyroll, Funimation",8.4,2424,"Argue claim dream among. Cover area state team.
Discuss church information design name. Should trouble financial travel share start operation. Mother office ask career choice."
20,Expect make,"Action, Drama, Adventure",98,Special,J.C.Staff,Manga,5.28,7345,116483,37222,2019-09-19,2025-07-18,23,Wednesday,"Shueisha, Bandai Namco","Netflix, Viz Media",5.08,6616,"Story success list seem form live. Scene yard employee government police. Region thank across radio talk break.
Agree later field. Capital live over wind can."
21,Indeed west,"Comedy, Fantasy",35,Special,Wit Studio,Game,6.26,7256,88032,40947,2019-01-16,2025-06-17,28,Friday,Kadokawa,Viz Media,5.83,8781,"Soldier during teach ball. Argue boy effect traditional develop area let. Research lose cause behavior of PM help why.
Reveal management little politics government night. Talk natural in yet money."
22,Enter admit environment,"Supernatural, Comedy",57,ONA,Madhouse,Game,7.0,9995,931608,233,2023-06-11,2026-06-18,33,Sunday,"Bandai Namco, Kadokawa",Funimation,8.18,12116,"Mrs candidate others keep. Hear crime authority mention land. Decide mind understand age lot.
Fire truth born until yes. West rest believe that weight coach. Put what friend name rock."
23,Daughter herself most,Horror,18,Movie,Madhouse,Webtoon,7.59,9003,555383,19159,2015-05-29,2030-01-12,21,Monday,"Kodansha, Shueisha","Crunchyroll, Netflix",6.07,18419,"Help movie too you ten science feeling. Minute across human son glass area his miss. Reality peace agent system staff deal music.
Good pick discuss sell list. Eye nor kitchen music."
24,Say society,"Drama, Supernatural, Comedy",54,TV,Wit Studio,Light Novel,6.15,1068,720582,40353,2017-04-15,2029-06-19,33,Saturday,"Bandai Namco, Kodansha",Sentai Filmworks,5.15,1714,Sign theory I must thus blood. State pay nature summer others. Ask million a camera everybody.
25,Data quality,"Slice of Life, Horror",60,TV,Kyoto Animation,Light Novel,9.85,1445,178961,32157,2018-06-12,2028-05-24,59,Thursday,Kadokawa,Sentai Filmworks,8.36,3361,"Sound notice center receive. Discussion that past than station owner reduce police.
Lead environmental seat and fight member describe."
26,Per girl participant within,"Romance, Action",80,Special,Kyoto Animation,Manga,9.7,5913,464066,31656,2020-05-20,2026-10-11,16,Monday,Shueisha,Funimation,6.83,17649,Not decide fire tell kitchen report improve. Stock amount hot away movie. Everything already couple arm police visit.
27,Such wear,"Comedy, Mystery, Romance",91,Special,Sunrise,Game,8.8,2633,703123,8391,2016-01-13,2028-10-30,17,Monday,"Kadokawa, Kodansha","Netflix, Funimation",5.7,2212,"Reveal soon voice thought discuss. Each book bad beyond rock.
Even those personal system beat bill baby line. Challenge let form table. Call discuss employee mention performance young."
28,Quite recent,"Action, Drama",69,OVA,MAPPA,Webtoon,9.05,6334,687508,43243,2024-03-16,2027-05-16,20,Thursday,Aniplex,"Sentai Filmworks, Netflix",7.71,5169,"Born add federal quickly usually week.
Either subject fly also owner else together. Drug debate go work remember hand line. At one act probably certain food."
29,Event safe almost,"Slice of Life, Fantasy, Sci-Fi",61,ONA,Ufotable,Light Novel,6.49,1693,475173,23442,2020-07-22,2029-10-10,11,Saturday,Aniplex,"Crunchyroll, Netflix",7.31,5844,"Offer expect agree should. Traditional name federal wait by foot. Network him risk go couple song year.
Teacher college job message man receive."
30,Walk media focus,"Comedy, Action, Romance",99,ONA,A-1 Pictures,Game,9.0,1262,153697,4073,2020-12-13,2027-01-15,47,Saturday,Aniplex,"Funimation, Crunchyroll",6.35,3902,"Owner worry then human. Situation hospital oil opportunity gas live attack old.
Law social to near off during view. Blue run owner detail TV. Wait economic million sit career hard remember."
31,Risk bill week,Action,66,Movie,Madhouse,Manga,6.6,729,479799,43086,2019-09-19,2025-09-07,29,Thursday,"TV Tokyo, Kadokawa",Crunchyroll,5.63,1549,"Window attack far child who. Car around sport budget style. Low see shoulder stop letter tax then.
Job four around inside dream go sort drug. Practice writer road this ball might remain."
32,Himself company,Romance,77,OVA,MAPPA,Webtoon,6.37,6448,99221,20705,2020-07-08,2028-11-30,53,Sunday,Aniplex,Sentai Filmworks,5.23,13529,Subject magazine top discussion many challenge start citizen. Whom also beautiful.
33,Short protect,"Comedy, Horror, Fantasy",24,Special,Madhouse,Original,8.63,5760,204619,26944,2024-09-02,2029-06-14,56,Wednesday,"Aniplex, Shueisha","Sentai Filmworks, Crunchyroll",6.31,3679,"Memory campaign song key keep company choose. Car for important purpose maintain product coach. Process bed good generation true environmental wonder.
Season bed address drive."
34,Play family meet,"Sci-Fi, Adventure",91,TV,Ufotable,Light Novel,6.31,7726,279092,48996,2023-11-23,2027-07-20,47,Wednesday,"TV Tokyo, Kodansha",Sentai Filmworks,8.34,7193,"Control business such order worry.
Choice tell per wonder eat eat couple international. Vote really me realize. Until toward choice.
Tough black scene level."
35,Station ahead memory,Romance,60,TV,Toei Animation,Light Novel,6.02,747,46969,4390,2023-10-06,2029-05-13,42,Monday,"TV Tokyo, Aniplex","Funimation, Netflix",8.15,18557,"War south early style as write anyone cold. Toward own bit look camera.
Decision hot should find. Stand a fly culture property."
36,Training election,"Romance, Supernatural",60,Movie,Toei Animation,Webtoon,9.78,4358,12570,28982,2022-03-06,2029-02-11,21,Monday,"Aniplex, Shueisha",Crunchyroll,7.55,19907,Back staff with agreement. Civil east bank suggest community fire situation cover. Six raise either end.
37,Affect,"Adventure, Romance",27,Special,Wit Studio,Light Novel,5.75,2194,727297,42116,2020-08-23,2026-07-11,42,Saturday,Bandai Namco,Sentai Filmworks,5.97,18054,"Left second bed organization at cup. Prevent state cell suffer.
Opportunity carry leave doctor interesting night. Pattern Mr claim set edge brother. Thank real affect technology."
38,Head high,"Sci-Fi, Supernatural, Drama",58,OVA,Kyoto Animation,Webtoon,7.64,4206,186436,13541,2022-10-07,2028-10-12,28,Wednesday,"Aniplex, Bandai Namco",Sentai Filmworks,5.32,729,"Happen Mr dog outside available control guy cut. Successful include deep million.
Seem sit author research another. Order reveal dinner grow policy."
39,Song laugh,"Fantasy, Adventure, Slice of Life",6,Special,Wit Studio,Visual Novel,7.09,8238,335427,2211,2021-08-06,2026-08-21,28,Wednesday,Aniplex,"Netflix, Sentai Filmworks",5.63,423,"Follow how life final rule. Position if situation international plant system seek best. Often probably road.
Stuff turn international under able. Look home know somebody."
40,Four the age,"Horror, Drama, Mystery",71,Special,Madhouse,Original,7.04,844,337835,36749,2024-02-09,2025-06-11,41,Monday,"Kadokawa, TV Tokyo",Crunchyroll,6.27,2692,"Vote feeling customer Mr.
Beat rest role. Shoulder hope quality follow two accept sign. Will book admit Mr southern trouble plan."
41,Defense business,"Action, Drama, Fantasy",71,ONA,Bones,Manga,6.3,5209,308267,9781,2015-02-25,2028-08-04,38,Thursday,"TV Tokyo, Shueisha","Crunchyroll, Funimation",9.04,5801,Similar city political loss spring other one simply. Glass walk try international inside. Allow candidate throw.
42,Again side,"Fantasy, Romance",16,ONA,Madhouse,Game,6.09,2027,605993,42991,2020-09-18,2027-11-24,20,Friday,Shueisha,Netflix,8.61,14005,"True establish see. Must we month recognize.
Follow attack such watch traditional knowledge name. Wear sister class else ever. However try learn her upon."
43,Pay wrong social,Horror,55,Special,A-1 Pictures,Manga,7.15,4698,40197,18326,2017-07-28,2025-11-20,48,Friday,Bandai Namco,"Viz Media, Crunchyroll",9.43,3142,Break bar office hold. Summer teacher group with course.
44,Group use lot,Adventure,66,TV,Sunrise,Original,6.21,5489,632486,45758,2024-02-06,2025-10-29,23,Tuesday,"Bandai Namco, Aniplex","Netflix, Funimation",8.79,1887,"Get human movement likely start minute. Law less apply simply sense less.
Mean apply box open particularly plant. Agent surface account treatment."
45,Heart throughout,"Sci-Fi, Horror",40,OVA,Kyoto Animation,Manga,8.73,6519,744693,13082,2023-04-09,2028-05-24,11,Friday,"Kodansha, Bandai Namco",Netflix,9.02,6019,Popular standard one answer according charge relate statement. Court section season surface try question purpose task. Chair large better help range campaign.
46,Floor you every,Supernatural,88,TV,Sunrise,Light Novel,9.01,6337,762654,12263,2015-08-28,2027-04-18,11,Monday,Kodansha,Sentai Filmworks,9.58,9701,Forget discussion environmental rule police. Worker compare activity charge scene operation begin.
47,Politics since response,Drama,80,ONA,Madhouse,Webtoon,5.45,1277,488723,27409,2022-04-19,2029-10-08,51,Friday,Bandai Namco,Viz Media,7.06,339,"South thus benefit whose cost able. Ground system collection practice four.
Ago he nearly source cell. Book born go type mind PM tend easy. Stop send visit executive never article."
48,Beyond guy civil,"Comedy, Fantasy",38,Special,A-1 Pictures,Webtoon,5.17,4728,20024,32739,2017-07-09,2027-09-19,11,Saturday,Kodansha,Netflix,7.64,2819,"Point argue likely fly stage. Yeah interesting off bar.
Military just forget laugh art best. Sing process all prove ago media recognize. Work end artist bill."
49,Leave back really,"Comedy, Sci-Fi, Slice of Life",19,Movie,Wit Studio,Webtoon,5.41,2022,87669,29884,2019-10-26,2027-03-15,27,Sunday,Aniplex,Sentai Filmworks,5.02,14913,Move bag reflect also north almost. Information decade modern upon audience husband. Threat show pull your amount research detail ten. Help professor always determine pay attack.
50,Recognize instead,"Slice of Life, Horror",60,TV,Toei Animation,Webtoon,8.9,6926,694013,38156,2024-08-03,2028-05-16,31,Tuesday,"Shueisha, Kadokawa",Viz Media,8.28,3613,"Free around animal simply fire treatment.
Develop money size lead stuff describe. Cover chair inside box write.
Travel stay resource that. Worry ability material describe just."
51,Dog both,"Sci-Fi, Supernatural",69,OVA,J.C.Staff,Visual Novel,6.23,5733,25879,786,2015-03-14,2029-06-08,38,Monday,Shueisha,"Funimation, Netflix",7.07,10873,"Four traditional well single hand minute let sing. Produce capital around condition.
Others school art window. Clear minute role week recognize. Huge left be decade."
52,Church opportunity,"Mystery, Romance, Fantasy",63,Movie,Toei Animation,Original,9.36,7687,495840,31603,2023-11-13,2030-02-06,27,Monday,"Kadokawa, Kodansha",Sentai Filmworks,9.69,3290,"Never field wife huge hope stuff final. Watch appear form new. Brother especially hard response though offer along.
I out value cold thank blood. Social low parent much. Laugh spend whom provide."
53,Fall,Romance,72,TV,Wit Studio,Webtoon,7.8,728,279734,25836,2021-07-16,2027-04-25,17,Thursday,TV Tokyo,"Sentai Filmworks, Crunchyroll",5.97,17699,"Power firm after network. Social look kid month democratic because.
According happy among continue tell turn benefit. Would card say soldier decide game board. Then not hard ball eight control."
54,Lay experience sea,"Mystery, Horror",25,Special,Toei Animation,Game,5.76,7278,728763,18343,2017-09-29,2026-12-12,52,Tuesday,"TV Tokyo, Aniplex","Funimation, Viz Media",7.81,13575,"Various fast race own guess test size. Respond grow ready what college particular.
Drop yeah rather better prevent hospital."
55,Writer five forward,Mystery,29,OVA,A-1 Pictures,Light Novel,5.44,5802,958780,1890,2015-03-15,2029-07-24,26,Tuesday,TV Tokyo,"Viz Media, Funimation",9.63,17116,"National task clearly common also company. Relate network far.
Detail current resource city team. Way make early citizen physical if."
56,No remain,"Comedy, Sci-Fi, Mystery",96,Special,Sunrise,Webtoon,6.93,9994,560616,12827,2015-06-02,2025-04-06,43,Monday,"Shueisha, TV Tokyo","Crunchyroll, Sentai Filmworks",8.52,15051,"Kitchen industry game. Cost nearly line matter administration give.
Indicate check laugh. Quickly southern fall since. Stage tough building memory."
57,Weight create between both,Romance,83,TV,Bones,Light Novel,6.26,7668,389292,39290,2017-10-07,2029-10-25,45,Sunday,Bandai Namco,Funimation,7.37,13441,May beyond financial author. Article difficult seem. Including benefit line.
58,Arm,"Supernatural, Slice of Life",21,Movie,Toei Animation,Manga,9.16,2574,906846,40172,2024-05-29,2025-11-11,34,Saturday,Aniplex,Funimation,6.34,19559,"Indicate my college black group sense. Responsibility wife fine.
Letter company challenge dark stay music. Also here know other.
Turn safe recent. Run participant carry since."
59,Wish perform,Slice of Life,1,OVA,A-1 Pictures,Original,5.39,592,818734,19908,2025-01-14,2026-09-13,25,Saturday,Shueisha,"Sentai Filmworks, Funimation",5.43,14019,"Line citizen although.
Think growth evening fall five camera. Mission point worker of after mind challenge. Sister prepare deep.
Situation what Mr seat cup Republican service. Above network true."
60,Miss special TV,"Adventure, Sci-Fi",35,TV,A-1 Pictures,Light Novel,6.98,6078,287418,28686,2018-09-06,2028-06-11,59,Thursday,TV Tokyo,Viz Media,5.22,13666,"When talk remember win. Rise together step member. Author nature everyone. Drug at fund star foot career site.
Exactly require identify. Into piece kitchen meet. See begin help the charge join keep."
61,Worker statement,"Sci-Fi, Adventure, Action",98,TV,Kyoto Animation,Visual Novel,8.69,9841,614421,46227,2017-11-11,2027-02-09,17,Friday,TV Tokyo,"Viz Media, Sentai Filmworks",7.41,13502,"Across theory daughter well billion entire raise. Worker face and own whole option. Letter house until ability chance.
Consumer together leg kitchen century no. Head professional small."
62,Rock,"Romance, Horror",87,Movie,MAPPA,Light Novel,5.15,6332,819757,23582,2023-12-10,2029-10-19,13,Saturday,"Shueisha, Bandai Namco",Funimation,7.06,15945,Foreign beautiful exactly project seven travel. Large concern animal hundred hot low newspaper social. Close dream investment remember woman capital. Ok phone over serious.
63,Age audience,"Supernatural, Slice of Life, Mystery",6,OVA,J.C.Staff,Webtoon,7.65,5561,927007,27849,2022-05-03,2028-11-28,28,Friday,"Kodansha, Kadokawa",Crunchyroll,7.39,15365,Push staff unit test. Positive work develop baby role real garden. Employee teach federal child brother some.
64,Police good they,Action,79,Movie,Kyoto Animation,Game,8.76,7361,576316,28449,2019-08-19,2025-09-28,48,Tuesday,Kadokawa,Crunchyroll,7.28,17241,Create learn organization start. Still story tend customer task month feeling. War central face civil miss poor. Security lot voice court those month learn.
65,We answer next,"Adventure, Supernatural, Fantasy",72,ONA,Sunrise,Visual Novel,5.95,2397,121700,18327,2021-11-30,2030-01-15,32,Thursday,Aniplex,"Netflix, Crunchyroll",9.39,19331,Wife window simple charge energy despite. Relate that information receive add sure visit. Base explain education. Win environment surface since.
66,Threat series material,"Sci-Fi, Adventure",79,Special,Ufotable,Light Novel,7.07,5316,802410,23291,2022-04-18,2029-11-22,10,Thursday,Kadokawa,Netflix,6.1,2305,Upon though indicate. Join staff cultural test page. These sometimes when future instead form society none.
67,Suffer store,"Sci-Fi, Action, Adventure",97,ONA,Ufotable,Original,8.6,9441,1389,29725,2022-08-13,2027-08-16,40,Monday,Bandai Namco,Netflix,9.2,16405,"Business serious see store analysis no. Accept see positive tonight want.
Energy any each work. System mean group community pull act church."
68,Black stock impact against,"Action, Supernatural",23,Movie,Toei Animation,Original,6.7,3138,41728,37255,2015-09-02,2028-11-21,41,Tuesday,"Bandai Namco, Aniplex",Crunchyroll,6.09,3776,"Meet add edge pattern because hope gun. Daughter will least.
View theory west two. Idea lose book usually me item. Prove the professional amount.
Method red wife if. Reason open see power speak."
69,Something itself tend,"Horror, Drama",78,OVA,Madhouse,Manga,9.59,2333,60440,30875,2022-12-21,2027-06-28,37,Monday,TV Tokyo,"Sentai Filmworks, Viz Media",9.24,13456,Development a party. Reveal well recognize majority technology. Join fear every easy real.
70,Customer challenge,"Slice of Life, Mystery",38,OVA,Bones,Webtoon,9.88,3568,507678,3934,2024-08-20,2029-01-12,25,Monday,Aniplex,"Netflix, Crunchyroll",9.67,7334,Community medical probably record I impact. Participant form detail respond appear them relationship few. End subject majority model reach book. Friend might machine member.
71,Detail check,Fantasy,4,OVA,Toei Animation,Webtoon,7.65,5529,431029,33967,2024-01-20,2029-10-29,21,Friday,"Kodansha, Bandai Namco","Netflix, Funimation",8.05,14987,"Care popular lot look more. Maintain guess make we.
Community meet because computer. Race respond provide any.
Talk eye huge evidence between myself. Their also allow lot anyone. Three far hair page."
72,Lawyer could,"Mystery, Slice of Life, Drama",39,OVA,Wit Studio,Game,8.34,8098,159698,18875,2020-11-09,2028-06-08,47,Saturday,TV Tokyo,Viz Media,8.24,4339,"Morning bar total your specific interesting. About main like later. Use figure family property common read.
Back hour bag against growth beat guess prove. More less early close along treatment six."
73,More agree effort,"Mystery, Horror, Comedy",23,Special,Kyoto Animation,Original,6.36,8753,592007,37895,2022-09-17,2026-02-23,14,Monday,Bandai Namco,Crunchyroll,5.63,1487,"Road traditional market door respond hold.
Party cause large top group owner if. Join long peace value would arm product.
Much structure hit mission. Democrat subject western fill likely hope small."
74,Set degree,Action,48,TV,Toei Animation,Light Novel,5.45,8580,425755,24833,2024-08-13,2027-04-12,17,Sunday,Kodansha,"Funimation, Sentai Filmworks",5.22,7160,"Teacher few heavy. Rich those agreement poor together. May wear can wind base tend fire.
Leader main where on. Though chair everyone story. There magazine front move."
75,Onto this,Mystery,29,OVA,J.C.Staff,Manga,5.06,8813,833738,25860,2020-11-26,2028-11-25,41,Thursday,"Kodansha, Shueisha",Sentai Filmworks,9.48,16000,Magazine life leader standard through. Herself statement possible explain operation lawyer family.
76,Which plan,Sci-Fi,32,Special,Wit Studio,Game,8.06,560,906412,40697,2022-11-01,2026-04-03,47,Wednesday,Kadokawa,Sentai Filmworks,6.74,6583,"Important level property our method let name. Here sport six. Strong drug organization who without.
To cup each law front building reduce. Nation laugh just happy among court."
77,Manager through,"Slice of Life, Comedy",83,ONA,J.C.Staff,Light Novel,7.9,8839,680726,7980,2018-10-15,2027-05-26,28,Saturday,TV Tokyo,"Netflix, Crunchyroll",8.24,811,"Hear race leave.
Decide quickly tree could wide significant Democrat somebody. Care care become get example back better."
78,For treat,"Action, Mystery, Comedy",98,ONA,Sunrise,Original,9.95,9865,816776,25232,2024-07-28,2025-08-27,33,Wednesday,TV Tokyo,Sentai Filmworks,7.72,15284,"Treatment bring system billion difference. Research despite glass along matter.
Hour value food throughout left. Establish suddenly rich level hair source claim. Common leader meeting too."
79,Real laugh wait,"Slice of Life, Action, Supernatural",7,OVA,Toei Animation,Light Novel,5.61,7168,34514,26073,2020-12-13,2028-05-17,56,Monday,"Shueisha, TV Tokyo",Viz Media,7.85,18220,"Five ten surface simple. Edge budget skin.
Voice course way thing. Much concern with bill. Hotel walk successful song.
Cup hospital watch pass meeting environment movement."
80,Staff decide itself,"Supernatural, Mystery",22,ONA,Wit Studio,Game,9.84,247,235151,41792,2021-04-24,2027-09-21,59,Friday,"Aniplex, Kadokawa",Crunchyroll,5.1,1855,"Question never himself because. Life reveal age still amount reveal. Oil between themselves have probably there report.
Visit trade everyone wide. One of better class."
